{
  "$schema": "https://schemas.alos.dev/v1/tool/tool-request.schema.json",
  "tool_call_id": "toolcall_mvp1_document_read_001",
  "run_id": "run_mvp1_document_review_001",
  "tool_id": "document.read",
  "execution_context": {
    "tenant_id": "tenant_mvp1_andara",
    "organization_id": "org_mvp1_andara",
    "workspace_id": "workspace_mvp1_ops",
    "actor_id": "actor_mvp1_it_lead",
    "authority_context": {
      "role": "IT_LEAD",
      "authority_level": "IT_APPROVER"
    },
    "permission_refs": ["permission.document.read"],
    "scope_refs": ["scope.workspace.ops"],
    "data_classification": "INTERNAL",
    "correlation_id": "corr_mvp1_contract_001"
  },
  "arguments": {
    "document_id": "document_mvp1_001"
  },
  "idempotency_key": "mvp1-document-read-001",
  "requested_at": "2026-09-16T02:00:00Z"
}
